{
  "schema_version": "0.1.0",
  "kind": "tile_lesson",
  "path_id": "data_analyst",
  "tile_id": "tile_sql_adv_joining_tables",
  "toc_location": {
    "region_id": "region_sql_joins_advanced",
    "terrain_id": "terrain_sql_joins_subqueries_advanced"
  },
  "title": "Joining Tables",
  "summary": "",
  "concept_ids": [
    "sql.inner_join",
    "sql.composite_join_conditions",
    "sql.outer_joins"
  ],
  "source": {
    "glossary_batch_id": "glossary_batch_001_data_analyst_pilot",
    "toc_freeze_hash": "51f00dd4c4de431b068de76836c5090cf158a002d2ca2bfa57a5e0d5f8b1f4da",
    "glossary_bundle_hashes": {
      "sql.inner_join": "7510ca506e063cdfdcfda5cba3a361db19f417873a5168e5411be2a02a6e04aa",
      "sql.composite_join_conditions": "ab9282141d82e6f5537f00009eeec99f97b62a0761b746ca0ef7419ea464277e",
      "sql.outer_joins": "c7ba4502170de5b68e14fef20b32bf637ec7c395f6fbb055530ea7a99ac09cd7"
    },
    "scenario_registry_hash": "8169f479f065b4cdbc086cc52d4350186682da70cfa154834ab1afe6136600f9"
  },
  "requires": {
    "min_player_version": "0.1.0",
    "packs": [
      "core"
    ],
    "block_types": [
      "code_walkthrough",
      "diagram",
      "media_group",
      "prose",
      "up_next"
    ],
    "interaction_types": [
      "choice",
      "code_exercise"
    ],
    "runtimes": [
      "sql"
    ],
    "asset_ids": [
      "ds_customers",
      "ds_order_items",
      "ds_orders",
      "ds_shipments"
    ]
  },
  "pacing": {
    "estimated_minutes": 22.3
  },
  "steps": [
    {
      "step_id": "tile_sql_adv_joining_tables.s01",
      "type": "explainer",
      "concept_ids": [
        "sql.inner_join"
      ],
      "eyebrow": "INNER JOIN",
      "title": "Combining two tables on a shared key",
      "lede": "The customers table holds names; the orders table holds delivery times. To see both together, you join them.",
      "blocks": [
        {
          "type": "prose",
          "block_id": "tile_sql_adv_joining_tables.s01.b1",
          "role": "intro",
          "text": "QuickCart stores customer names in a customers table and delivery times in a separate orders table. Each orders row carries a customer_id that points back to customers. To see a customer's name alongside their delivery times, you need both tables combined into one result — that's what a JOIN does.",
          "lineage": {
            "concept_ids": [
              "sql.inner_join"
            ],
            "teaching_block_ids": [
              "sql.inner_join#tb1"
            ],
            "fact_ids": [
              "sql.inner_join#f1"
            ]
          }
        },
        {
          "type": "prose",
          "block_id": "tile_sql_adv_joining_tables.s01.b2",
          "role": "definition",
          "text": "For each row of T1, an INNER JOIN produces a joined row for each row of T2 that satisfies the join condition; rows from either table with no match are dropped. The query SELECT c.name, o.delivery_time_minutes FROM customers AS c JOIN orders AS o ON c.customer_id = o.customer_id pairs every customer row with every order row that shares its customer_id.",
          "lineage": {
            "concept_ids": [
              "sql.inner_join"
            ],
            "teaching_block_ids": [
              "sql.inner_join#tb2"
            ],
            "fact_ids": [
              "sql.inner_join#f1"
            ]
          }
        },
        {
          "type": "prose",
          "block_id": "tile_sql_adv_joining_tables.s01.b3",
          "role": "syntax",
          "text": "The join condition goes in an ON clause — a boolean expression like those used in WHERE — or in a USING clause when both tables share the same column name. ON c.customer_id = o.customer_id can be written USING (customer_id) when the column name is identical in both tables. INNER is the default: writing JOIN alone, without LEFT, RIGHT, or FULL, already means an INNER JOIN.",
          "lineage": {
            "concept_ids": [
              "sql.inner_join"
            ],
            "teaching_block_ids": [
              "sql.inner_join#tb3"
            ],
            "fact_ids": [
              "sql.inner_join#f2",
              "sql.inner_join#f3"
            ]
          }
        },
        {
          "type": "diagram",
          "block_id": "tile_sql_adv_joining_tables.s01.b4",
          "diagram_kind": "erd",
          "title": "INNER JOIN: only matched rows survive",
          "nodes": [
            {
              "id": "c1",
              "label": "customer_id=1 | Amara Okafor",
              "kind": "matched",
              "group": "customers"
            },
            {
              "id": "c2",
              "label": "customer_id=2 | Emeka Nwosu",
              "kind": "matched",
              "group": "customers"
            },
            {
              "id": "c3",
              "label": "customer_id=3 | Fatima Aliyu",
              "kind": "matched",
              "group": "customers"
            },
            {
              "id": "c4",
              "label": "customer_id=4 | Chidi Eze",
              "kind": "unmatched",
              "group": "customers"
            },
            {
              "id": "o1001",
              "label": "order_id=1001 | cust=1",
              "kind": "matched",
              "group": "orders"
            },
            {
              "id": "o1002",
              "label": "order_id=1002 | cust=2",
              "kind": "matched",
              "group": "orders"
            },
            {
              "id": "o1003",
              "label": "order_id=1003 | cust=1",
              "kind": "matched",
              "group": "orders"
            },
            {
              "id": "o1004",
              "label": "order_id=1004 | cust=3",
              "kind": "matched",
              "group": "orders"
            },
            {
              "id": "o1007",
              "label": "order_id=1007 | cust=3",
              "kind": "matched",
              "group": "orders"
            },
            {
              "id": "c4_note",
              "label": "customer_id=4 (Chidi Eze) has no matching order — dropped from result",
              "kind": "annotation",
              "group": "note"
            }
          ],
          "edges": [
            {
              "from": "c1",
              "to": "o1001",
              "label": "match"
            },
            {
              "from": "c1",
              "to": "o1003",
              "label": "match"
            },
            {
              "from": "c2",
              "to": "o1002",
              "label": "match"
            },
            {
              "from": "c3",
              "to": "o1004",
              "label": "match"
            },
            {
              "from": "c3",
              "to": "o1007",
              "label": "match"
            }
          ],
          "alt_text": "customers rows on the left, orders rows on the right. Rows with matching customer_id are linked. customer_id=1 (Amara Okafor) matches orders 1001 and 1003; customer_id=2 (Emeka Nwosu) matches order 1002; customer_id=3 (Fatima Aliyu) matches orders 1004 and 1007. customer_id=4 (Chidi Eze) has no matching order and is dropped from the result.",
          "lineage": {
            "concept_ids": [
              "sql.inner_join"
            ],
            "teaching_block_ids": [
              "sql.inner_join#tb2",
              "sql.inner_join#tb3"
            ],
            "fact_ids": [
              "sql.inner_join#f1",
              "sql.inner_join#f2"
            ],
            "anchors": [
              "sql.inner_join#visual"
            ]
          }
        }
      ],
      "reward": {
        "gems": 5
      },
      "lineage": {
        "concept_ids": [
          "sql.inner_join"
        ],
        "teaching_block_ids": [
          "sql.inner_join#tb1",
          "sql.inner_join#tb2",
          "sql.inner_join#tb3"
        ],
        "fact_ids": [
          "sql.inner_join#f1",
          "sql.inner_join#f2",
          "sql.inner_join#f3"
        ],
        "anchors": [
          "sql.inner_join#visual"
        ]
      }
    },
    {
      "step_id": "tile_sql_adv_joining_tables.s02",
      "type": "video",
      "concept_ids": [
        "sql.inner_join"
      ],
      "title": "INNER JOIN in action",
      "blocks": [
        {
          "type": "media_group",
          "block_id": "tile_sql_adv_joining_tables.s02.b1",
          "segment_ids": [
            "seg_sql.inner_join_9URM1_2S0ho_76_244"
          ],
          "segments": [
            {
              "segment_id": "seg_sql.inner_join_9URM1_2S0ho_76_244",
              "video_id": "9URM1_2S0ho",
              "youtube_url": "https://www.youtube.com/watch?v=9URM1_2S0ho",
              "review_url": "https://www.youtube.com/watch?v=9URM1_2S0ho&t=76s",
              "start_seconds": 76,
              "end_seconds": 244,
              "label": "INNER JOIN of two employee tables on employee ID, with a Venn picture of what survives",
              "summary": "Defines a join as a way to combine several tables into one output, shown with an employee demographics table and an employee salary table that share an employee ID. The query writes JOIN with an ON condition matching the two employee ID columns, and the speaker notes that JOIN alone means an inner join. A Venn graphic then shows an inner join keeping only the matching rows, with data missing for rows that do not match.",
              "fact_ids": [
                "f1",
                "f2",
                "f3"
              ],
              "transcript_ref": "9URM1_2S0ho:76-244"
            }
          ],
          "group_title": "INNER JOIN on a shared key",
          "bridge": {
            "before": "Watch the ON condition that matches employee ID in both tables, then the Venn picture of what survives.",